{
  "entity_id": "gamme:filtre-a-carburant",
  "entity_type": "gamme",
  "schema_version": "1.1.0",
  "projection_contract_version": "1.0.0",
  "source_wiki_commit": "a47833486352626442939dd04b5a6fd3674cb0a7",
  "wiki_path": "wiki/gamme/filtre-a-carburant.md",
  "content_hash": "sha256:cf85c2a5e56c6a64483a5119319991398b5dfdcf81260a1e67cc753f9d9f0208",
  "generated_at": "2026-10-01T00:50:04+02:00",
  "builder_version": "1.1.0",
  "facts": [],
  "sources": [
    {
      "id": "src-0",
      "type": "manual",
      "url": null
    },
    {
      "id": "src-1",
      "type": "manual",
      "url": null
    },
    {
      "id": "src-2",
      "type": "manual",
      "url": "https://www.vroomly.com/blog/filtre-a-gasoil-encrasse-symptomes/"
    },
    {
      "id": "src-3",
      "type": "manual",
      "url": "https://www.idgarages.com/fr-fr/prestations/revision-vidange/definition-filtre-a-gasoil"
    }
  ],
  "blocks": [],
  "roles_allowed": [
    "R3_CONSEILS",
    "R4_REFERENCE",
    "R6_GUIDE_ACHAT"
  ],
  "consumers_allowed": [
    "seo",
    "rag"
  ]
}
