{
  "entity_id": "gamme:filtre-d-habitacle",
  "entity_type": "gamme",
  "schema_version": "1.1.0",
  "projection_contract_version": "1.0.0",
  "source_wiki_commit": "a47833486352626442939dd04b5a6fd3674cb0a7",
  "wiki_path": "wiki/gamme/filtre-d-habitacle.md",
  "content_hash": "sha256:28915d6cde4c6c3f88d21fd5c91541933befd2b75c37dc45bdda3447ccf66572",
  "generated_at": "2026-10-01T00:50:04+02:00",
  "builder_version": "1.1.0",
  "facts": [],
  "sources": [
    {
      "id": "src-0",
      "type": "manual",
      "url": null
    },
    {
      "id": "src-1",
      "type": "manual",
      "url": "https://www.carglass.fr/faq/answers/5929/quand-changer-le-filtre-d-habitacle"
    },
    {
      "id": "src-2",
      "type": "manual",
      "url": "https://www.bymycar.fr/webzine/filtre-habitacle-charbon-actif-ou-pollen/"
    }
  ],
  "blocks": [],
  "roles_allowed": [
    "R3_CONSEILS",
    "R4_REFERENCE",
    "R6_GUIDE_ACHAT"
  ],
  "consumers_allowed": [
    "seo",
    "rag"
  ]
}
